{
  "schema_version": 1,
  "assets": [
    {
      "id": "female_cute_selfie_1",
      "character_id": "female_cute",
      "collection_id": "selfies",
      "type": "image",
      "file": "selfie_cafe.png",
      "tags": [
        "selfie",
        "cafe",
        "happy"
      ],
      "required_flags": [],
      "cooldown_ms": 45000,
      "enabled": true
    },
    {
      "id": "female_cute_selfie_2",
      "character_id": "female_cute",
      "collection_id": "selfies",
      "type": "image",
      "file": "selfie_home.png",
      "tags": [
        "selfie",
        "home",
        "shy"
      ],
      "required_flags": [],
      "cooldown_ms": 45000,
      "enabled": true
    },
    {
      "id": "female_cute_selfie_3",
      "character_id": "female_cute",
      "collection_id": "selfies",
      "type": "image",
      "file": "selfie_beach.png",
      "tags": [
        "selfie",
        "beach",
        "happy"
      ],
      "required_flags": [],
      "cooldown_ms": 45000,
      "enabled": true
    },
    {
      "id": "female_cute_cafe_memory",
      "character_id": "female_cute",
      "collection_id": "scenes",
      "type": "image",
      "file": "scene_cafe.png",
      "tags": [
        "cafe",
        "illustration"
      ],
      "required_flags": [],
      "enabled": true
    },
    {
      "id": "female_cute_home_memory",
      "character_id": "female_cute",
      "collection_id": "scenes",
      "type": "image",
      "file": "scene_home.png",
      "tags": [
        "home",
        "illustration"
      ],
      "required_flags": [],
      "enabled": true
    },
    {
      "id": "female_cute_travel",
      "character_id": "female_cute",
      "collection_id": "travel",
      "type": "image",
      "file": "scene_beach.png",
      "tags": [
        "beach",
        "illustration"
      ],
      "required_flags": [
        "trip_finished"
      ],
      "minimum_turns": 1,
      "maximum_sends": 2
    },
    {
      "id": "female_cute_beach_video",
      "character_id": "female_cute",
      "collection_id": "trip_videos",
      "type": "video",
      "file": "scene_beach_demo.mp4",
      "tags": [
        "beach",
        "demo",
        "camera_pan"
      ],
      "required_flags": [
        "trip_finished"
      ],
      "minimum_turns": 1,
      "maximum_sends": 2
    },
    {
      "id": "female_youth_selfie_1",
      "character_id": "female_youth",
      "collection_id": "selfies",
      "type": "image",
      "file": "selfie_cafe.png",
      "tags": [
        "selfie",
        "cafe",
        "happy"
      ],
      "required_flags": [],
      "cooldown_ms": 45000,
      "enabled": true
    },
    {
      "id": "female_youth_selfie_2",
      "character_id": "female_youth",
      "collection_id": "selfies",
      "type": "image",
      "file": "selfie_home.png",
      "tags": [
        "selfie",
        "home",
        "shy"
      ],
      "required_flags": [],
      "cooldown_ms": 45000,
      "enabled": true
    },
    {
      "id": "female_youth_selfie_3",
      "character_id": "female_youth",
      "collection_id": "selfies",
      "type": "image",
      "file": "selfie_beach.png",
      "tags": [
        "selfie",
        "beach",
        "happy"
      ],
      "required_flags": [],
      "cooldown_ms": 45000,
      "enabled": true
    },
    {
      "id": "female_youth_cafe_memory",
      "character_id": "female_youth",
      "collection_id": "scenes",
      "type": "image",
      "file": "scene_cafe.png",
      "tags": [
        "cafe",
        "illustration"
      ],
      "required_flags": [],
      "enabled": true
    },
    {
      "id": "female_youth_home_memory",
      "character_id": "female_youth",
      "collection_id": "scenes",
      "type": "image",
      "file": "scene_home.png",
      "tags": [
        "home",
        "illustration"
      ],
      "required_flags": [],
      "enabled": true
    },
    {
      "id": "female_youth_travel",
      "character_id": "female_youth",
      "collection_id": "travel",
      "type": "image",
      "file": "scene_beach.png",
      "tags": [
        "beach",
        "illustration"
      ],
      "required_flags": [
        "trip_finished"
      ],
      "minimum_turns": 1,
      "maximum_sends": 2
    },
    {
      "id": "female_youth_beach_video",
      "character_id": "female_youth",
      "collection_id": "trip_videos",
      "type": "video",
      "file": "scene_beach_demo.mp4",
      "tags": [
        "beach",
        "demo",
        "camera_pan"
      ],
      "required_flags": [
        "trip_finished"
      ],
      "minimum_turns": 1,
      "maximum_sends": 2
    },
    {
      "id": "female_elegant_selfie_1",
      "character_id": "female_elegant",
      "collection_id": "selfies",
      "type": "image",
      "file": "selfie_cafe.png",
      "tags": [
        "selfie",
        "cafe",
        "happy"
      ],
      "required_flags": [],
      "cooldown_ms": 45000,
      "enabled": true
    },
    {
      "id": "female_elegant_selfie_2",
      "character_id": "female_elegant",
      "collection_id": "selfies",
      "type": "image",
      "file": "selfie_home.png",
      "tags": [
        "selfie",
        "home",
        "shy"
      ],
      "required_flags": [],
      "cooldown_ms": 45000,
      "enabled": true
    },
    {
      "id": "female_elegant_selfie_3",
      "character_id": "female_elegant",
      "collection_id": "selfies",
      "type": "image",
      "file": "selfie_beach.png",
      "tags": [
        "selfie",
        "beach",
        "happy"
      ],
      "required_flags": [],
      "cooldown_ms": 45000,
      "enabled": true
    },
    {
      "id": "female_elegant_cafe_memory",
      "character_id": "female_elegant",
      "collection_id": "scenes",
      "type": "image",
      "file": "scene_cafe.png",
      "tags": [
        "cafe",
        "illustration"
      ],
      "required_flags": [],
      "enabled": true
    },
    {
      "id": "female_elegant_home_memory",
      "character_id": "female_elegant",
      "collection_id": "scenes",
      "type": "image",
      "file": "scene_home.png",
      "tags": [
        "home",
        "illustration"
      ],
      "required_flags": [],
      "enabled": true
    },
    {
      "id": "female_elegant_travel",
      "character_id": "female_elegant",
      "collection_id": "travel",
      "type": "image",
      "file": "scene_beach.png",
      "tags": [
        "beach",
        "illustration"
      ],
      "required_flags": [
        "trip_finished"
      ],
      "minimum_turns": 1,
      "maximum_sends": 2
    },
    {
      "id": "female_elegant_beach_video",
      "character_id": "female_elegant",
      "collection_id": "trip_videos",
      "type": "video",
      "file": "scene_beach_demo.mp4",
      "tags": [
        "beach",
        "demo",
        "camera_pan"
      ],
      "required_flags": [
        "trip_finished"
      ],
      "minimum_turns": 1,
      "maximum_sends": 2
    },
    {
      "id": "female_married_selfie_1",
      "character_id": "female_married",
      "collection_id": "selfies",
      "type": "image",
      "file": "selfie_cafe.png",
      "tags": [
        "selfie",
        "cafe",
        "happy"
      ],
      "required_flags": [],
      "cooldown_ms": 45000,
      "enabled": true
    },
    {
      "id": "female_married_selfie_2",
      "character_id": "female_married",
      "collection_id": "selfies",
      "type": "image",
      "file": "selfie_home.png",
      "tags": [
        "selfie",
        "home",
        "shy"
      ],
      "required_flags": [],
      "cooldown_ms": 45000,
      "enabled": true
    },
    {
      "id": "female_married_selfie_3",
      "character_id": "female_married",
      "collection_id": "selfies",
      "type": "image",
      "file": "selfie_beach.png",
      "tags": [
        "selfie",
        "beach",
        "happy"
      ],
      "required_flags": [],
      "cooldown_ms": 45000,
      "enabled": true
    },
    {
      "id": "female_married_cafe_memory",
      "character_id": "female_married",
      "collection_id": "scenes",
      "type": "image",
      "file": "scene_cafe.png",
      "tags": [
        "cafe",
        "illustration"
      ],
      "required_flags": [],
      "enabled": true
    },
    {
      "id": "female_married_home_memory",
      "character_id": "female_married",
      "collection_id": "scenes",
      "type": "image",
      "file": "scene_home.png",
      "tags": [
        "home",
        "illustration"
      ],
      "required_flags": [],
      "enabled": true
    },
    {
      "id": "female_married_travel",
      "character_id": "female_married",
      "collection_id": "travel",
      "type": "image",
      "file": "scene_beach.png",
      "tags": [
        "beach",
        "illustration"
      ],
      "required_flags": [
        "trip_finished"
      ],
      "minimum_turns": 1,
      "maximum_sends": 2
    },
    {
      "id": "female_married_beach_video",
      "character_id": "female_married",
      "collection_id": "trip_videos",
      "type": "video",
      "file": "scene_beach_demo.mp4",
      "tags": [
        "beach",
        "demo",
        "camera_pan"
      ],
      "required_flags": [
        "trip_finished"
      ],
      "minimum_turns": 1,
      "maximum_sends": 2
    }
  ],
  "rules": {
    "schema_version": 1,
    "relationship_stages": [
      {
        "id": "acquaintance",
        "name": "初识",
        "minimum_turns": 0
      },
      {
        "id": "familiar",
        "name": "熟悉",
        "minimum_turns": 5
      },
      {
        "id": "trusted",
        "name": "信任",
        "minimum_turns": 20
      }
    ],
    "events": [
      {
        "id": "trip_finished",
        "name": "旅行剧情完成",
        "trigger": "user_confirmation",
        "when": {
          "all": [
            {
              "scene_id": "beach"
            },
            {
              "minimum_turns": 1
            }
          ]
        },
        "grant_flags": [